{
  "$comment": "Captured hook payload: Antigravity CLI Runner (antigravity-cli)",
  "conversationId": "cli-8812-4cba-99ef",
  "workspacePaths": [
    "/home/developer/Desktop/AcademicSuite"
  ],
  "transcriptPath": "/home/developer/.gemini/antigravity-cli/brain/cli-8812-4cba-99ef/.system_generated/logs/transcript.jsonl",
  "artifactDirectoryPath": "/home/developer/.gemini/antigravity-cli/brain/cli-8812-4cba-99ef",
  "modelName": "auto",
  "stepIdx": 1,
  "toolCall": {
    "name": "run_command",
    "args": {
      "CommandLine": "pytest tests/architecture/"
    }
  },
  "agentName": "cli-developer",
  "track": 1,
  "mode": "developer",
  "isSubagent": false
}
